title,url,subject,modality,price,duration,registration,description
Cosmopolitan Tang: Aristocratic Culture in China,https://pll.harvard.edu/course/cosmopolitan-tang-aristocratic-culture-in-china,Humanities,Online,Free*,15 weeks,Available now,
"The Business of Entertainment, Media, and Sports",https://pll.harvard.edu/course/business-entertainment-media-and-sports,Business,In-Person,"$12,750",1 week,Starts Jun 3,
Data Science and AI Principles,https://pll.harvard.edu/course/data-science-and-ai-principles,Business,Online,"$1,200",5 weeks,Opens May 20,
Leveraging Multi-sided Platforms with AI for Business Leaders,https://pll.harvard.edu/course/leveraging-multi-sided-platforms-ai-business-leaders-0/2026-10,Business,Online Live,"$1,570",,Register by Oct 1,"Develop the strategies and skills you need to design, launch, and scale a successful and sustainable multi-sided digital platform."
Leadership Coaching Strategies,https://pll.harvard.edu/course/leadership-coaching-strategies-0,Business,In-Person,"$3,200",,Register by Apr 7,Learn leadership coaching strategies to help your team navigate business challenges and maximize performance.
"HealthXcelerate: Strategy, Policy, and Systems",https://pll.harvard.edu/course/healthxcelerate-strategy-policy-and-systems,Health & Medicine,Online,"$1,250",,Available now,
Rhetoric: The Art of Persuasive Writing and Public Speaking,https://pll.harvard.edu/course/rhetoric-art-persuasive-writing-and-public-speaking,Humanities,Online,Free*,8 weeks,Available now,
Data Science: R Basics,https://pll.harvard.edu/course/data-science-r-basics/2026-04,Data Science,Online,Free*,8 weeks,Opens Apr 15,
Emerging Leaders,https://pll.harvard.edu/course/emerging-leaders,Social Sciences,In-Person,"$11,300",1 week,Register by Mar 16,
Advanced Negotiation Skills,https://pll.harvard.edu/course/advanced-negotiation-skills-0/2026-12,Business,In-Person,"$3,200",,Register by Nov 29,Develop sophisticated negotiation skills to create value for all parties at the bargaining table.
Shakespeare’s Othello: The Moor,https://pll.harvard.edu/course/shakespeares-othello-moor,Humanities,Online,Free*,4 weeks,Available now,
Modern Masterpieces of World Literature,https://pll.harvard.edu/course/modern-masterpieces-world-literature/2026-03,Humanities,Online,Free*,8 weeks,Opens Mar 11,
Back Pain: Finding Solutions for Your Aching Back,https://pll.harvard.edu/course/back-pain-finding-solutions-your-aching-back,Health & Medicine,Online,$30,2 weeks,Available now,
"Persuasive Communication: Narrative, Evidence, and Impact",https://pll.harvard.edu/course/persuasive-communication-narrative-evidence-and-impact,Social Sciences,Online,"$4,900",2 weeks,Register by Apr 13,
Building a Legacy: Family Office Wealth Management,https://pll.harvard.edu/course/building-legacy-family-office-wealth-management,Business,In-Person,"$12,750",,Starts Mar 8,
Hinduism Through Its Scriptures,https://pll.harvard.edu/course/hinduism-through-its-scriptures,Humanities,Online,Free*,4 weeks,Available now,
Women on Boards: Getting On and Adding Value,https://pll.harvard.edu/course/women-boards-getting-and-adding-value-3,Health & Medicine,In-Person,"$3,800",,Register by May 1,
The Women's Leadership Forum,https://pll.harvard.edu/course/womens-leadership-forum,Business,In-Person,"$14,500",1 week,Starts Mar 2,
The Jewish Bible: Its History As A Physical Artifact,https://pll.harvard.edu/course/jewish-bible-its-history-physical-artifact,Humanities,Online,Free*,6 weeks,Available now,
Immune Tolerance,https://pll.harvard.edu/course/immune-tolerance,Health & Medicine,Online,$495,,Available now,
Data Science: Linear Regression,https://pll.harvard.edu/course/data-science-linear-regression,Data Science,Online,Free*,8 weeks,Available now,
Strategies for Inclusive Growth,https://pll.harvard.edu/course/strategies-inclusive-growth,Social Sciences,In-Person,"$10,600",1 week,Register by Mar 2,
Open Innovation,https://pll.harvard.edu/course/open-innovation,Business,Online,$950,5 weeks,Opens May 6,
Office Practice of Primary Care Medicine,https://pll.harvard.edu/course/office-practice-primary-care-medicine,Health & Medicine,Online Live,"$1,495",,Register by Mar 16,
Business Management: From Management to Leadership,https://pll.harvard.edu/course/business-management-management-leadership-0,Business,In-Person,"$6,150",,Register by Apr 19,Expand your business acumen to reach your full potential as a manager and leader within your organization.
Fundamentals of TinyML,https://pll.harvard.edu/course/fundamentals-tinyml,Computer Science,Online,Free*,5 weeks,Available now,
American Government: Constitutional Foundations,https://pll.harvard.edu/course/american-government-constitutional-foundations,Social Sciences,Online,Free*,,Available now,
Negotiation Strategies: Building Agreement Across Boundaries,https://pll.harvard.edu/course/negotiation-strategies-building-agreement-across-boundaries,Social Sciences,Online,"$5,100",1 week,Register by Mar 2,
Ethical Leadership,https://pll.harvard.edu/course/ethical-leadership-0,Business,Online Live,"$1,570",,Register by Aug 12,Develop the ability to lead through challenging dilemmas and competing values to promote ethical decision-making.
Deploying TinyML,https://pll.harvard.edu/course/deploying-tinyml/2026-02,Computer Science,Online,$0,,Available now,
The Health Effects of Climate Change,https://pll.harvard.edu/course/health-effects-climate-change,Health & Medicine,Online,Free*,7 weeks,Available now,
Managing Yourself and Leading Others,https://pll.harvard.edu/course/managing-yourself-and-leading-others-1,Business,In-Person,"$3,200",,Register by Mar 1,Evolve your leadership style to lead better and motivate others to accomplish your company's goals.
First Nights: Berlioz’s Symphonie Fantastique and Program Music in the 19th Century,https://pll.harvard.edu/course/first-nights-berlioz%E2%80%99s-symphonie-fantastique-and-program-music-19th-century,Art & Design,Online,Free*,3 weeks,Available now,
China’s Political and Intellectual Foundations: From Sage Kings to Confucius,https://pll.harvard.edu/course/chinas-political-and-intellectual-foundations,Humanities,Online,Free*,15 weeks,Available now,
Foundations of Data-Driven Decision Making with AI,https://pll.harvard.edu/course/foundations-data-driven-decision-making-ai-0,Business,In-Person,"$3,200",,Register by May 26,Understand the characteristics and applications of data sets in order to communicate effectively with your teams and develop business strategies.
Marketing Analytics: Strategies for Driving Business Results,https://pll.harvard.edu/course/marketing-analytics-strategies-driving-business-results-0,Business,In-Person,"$3,200",,Register by Jun 9,Transform your marketing strategy with data-driven leadership
Lifestyle Medicine and Wellness Coaching Immersion,https://pll.harvard.edu/course/lifestyle-medicine-and-wellness-coaching-immersion,Health & Medicine,In-Person,"$3,500",,Register by Mar 25,
Preparing to Be a Corporate Director,https://pll.harvard.edu/course/preparing-be-corporate-director/2026-09,Business,In-Person,"$13,000",1 week,Starts Sep 30,
Walking for Health,https://pll.harvard.edu/course/walking-health-0,Health & Medicine,Online,$30,2 weeks,Available now,
HKS Executive Education Faculty Webinar: Machine Learning for Leaders,https://pll.harvard.edu/course/hks-executive-education-faculty-webinar-machine-learning-leaders,Social Sciences,Online,Free*,,Available now,
18th-Century Opera: Handel & Mozart,https://pll.harvard.edu/course/18th-century-opera-handel-mozart,Art & Design,Online,Free*,3 weeks,Available now,
Executive Leadership Coaching,https://pll.harvard.edu/course/executive-leadership-coaching,Business,In-Person,"$3,200",,Register by May 10,"Deepen your executive coaching expertise. Apply the theories and principles of neuroscience, human development, and somatic (body-oriented) coaching to transform your executive and leadership coaching skills."
Designing and Executing Corporate Revitalization,https://pll.harvard.edu/course/designing-and-executing-corporate-revitalization,Business,In-Person,"$16,000",1 week,Starts Nov 29,
Justice,https://pll.harvard.edu/course/justice/2026-02,Humanities,Online,Free*,12 weeks,Available now,
Leadership Development for Physicians in Academic Health Centers,https://pll.harvard.edu/course/leadership-development-physicians-academic-health-centers-3/2026-10,Health & Medicine,In-Person,"$11,200",,Register by Sep 13,
AI Marketing Course: Transforming Strategies with Generative AI,https://pll.harvard.edu/course/ai-marketing-course-transforming-strategies-generative-ai,Business,In-Person,"$3,200",,Register by Apr 5,"Learn to harness generative AI, hyper-personalization, and predictive analytics to optimize customer engagement, boost conversions, and drive measurable growth."
The Consultant's Toolkit,https://pll.harvard.edu/course/consultants-toolkit-0/2026-08,Business,In-Person,"$3,200",,Register by Jul 28,Refine your consulting abilities through proven techniques to improve organizational effectiveness.
Advancing Women of Color in Leadership,https://pll.harvard.edu/course/advancing-women-color-leadership,Business,In-Person,"$6,000",1 week,Starts Apr 8,
Health Care Strategy,https://pll.harvard.edu/course/health-care-strategy/2026-07,Business,Online,"$1,600",5 weeks,Opens Jul 15,
CORe,https://pll.harvard.edu/course/core,Business,Online,"$2,650",,Available now,
Using Python for Research,https://pll.harvard.edu/course/using-python-research,Computer Science,Online,Free*,,Available now,
Statistics and R,https://pll.harvard.edu/course/statistics-and-r,Data Science,Online,Free*,4 weeks,Available now,
Statistical Inference and Modeling for High-throughput Experiments,https://pll.harvard.edu/course/data-analysis-life-sciences-3-statistical-inference-and-modeling-high-throughput-experiments,Data Science,Online,$0,4 weeks,Available now,
Crisis Leadership in Higher Education,https://pll.harvard.edu/course/crisis-leadership-higher-education,Social Sciences,In-Person,"$6,100",,Register by Dec 11,
Competing in the Age of AI—Virtual,https://pll.harvard.edu/course/competing-age-ai-virtual,Business,Online,"$7,250",12 weeks,Starts Sep 24,
Big Data for Social Good,https://pll.harvard.edu/course/big-data-social-good,Social Sciences,Online,$950,4 weeks,Opens Mar 18,
Ciencia de Datos: Fundamentos de R,https://pll.harvard.edu/course/ciencia-de-datos-fundamentos-de-r,Data Science,Online,Free*,4 weeks,Available now,
Strategy: Building and Sustaining Competitive Advantage,https://pll.harvard.edu/course/strategy-building-and-sustaining-competitive-advantage/2026-12,Business,In-Person,"$18,500",1 week,Starts Dec 13,
Digital Marketing Strategy,https://pll.harvard.edu/course/digital-marketing-strategy-0,Business,Online,"$1,850",7 weeks,Available now,
"Purpose, Perspective, and Persuasion",https://pll.harvard.edu/course/purpose-perspective-and-persuasion,Business,Online,$175,,Available now,
Product Management: From Design to Launch,https://pll.harvard.edu/course/product-management-design-launch-0/2026-09,Business,Online Live,"$2,950",,Register by Sep 1,Learn the essential skills of product management and drive business growth
Advanced Negotiation Skills,https://pll.harvard.edu/course/advanced-negotiation-skills-0/2026-09,Business,In-Person,"$3,200",,Register by Sep 22,Develop sophisticated negotiation skills to create value for all parties at the bargaining table.
Creating Brand Value,https://pll.harvard.edu/course/creating-brand-value,Business,In-Person,"$11,750",,Starts May 31,
Negotiation Essentials Online,https://pll.harvard.edu/course/negotiation-essentials-online,Business,Online,"$2,497",,Starts Mar 3,
CS50: Introduction to Computer Science,https://pll.harvard.edu/course/cs50-introduction-computer-science,Programming,Online,Free*,5 weeks,Available now,
Business and Climate Change,https://pll.harvard.edu/course/business-and-climate-change,Business,Online,"$1,850",5 weeks,Available now,
Japanese Books: From Manuscript to Print,https://pll.harvard.edu/course/japanese-books-manuscript-print,Humanities,Online,Free*,,Available now,
Early Childhood Development: Global Strategies for Interventions,https://pll.harvard.edu/course/early-childhood-development-global-strategies-interventions,Education & Teaching,Online,Free*,,Available now,
Stretching and Flexibility Exercises,https://pll.harvard.edu/course/stretching-and-flexibility-exercises,Health & Medicine,Online,$30,2 weeks,Available now,
Health Care Strategy,https://pll.harvard.edu/course/health-care-strategy,Business,Online,"$1,600",5 weeks,Opens Apr 15,
Advanced Negotiation Skills,https://pll.harvard.edu/course/advanced-negotiation-skills-0,Business,In-Person,"$3,200",,Register by Mar 16,Develop sophisticated negotiation skills to create value for all parties at the bargaining table.
HMX Immunology,https://pll.harvard.edu/course/hmx-immunology/2026-04,Health & Medicine,Online,"$1,025",,Register by Apr 7,
Growing as an Enterprise Leader,https://pll.harvard.edu/course/growing-enterprise-leader,Business,In-Person,"$18,000",1 week,Starts May 17,
Strategic Sales Management,https://pll.harvard.edu/course/strategic-sales-management-0/2026-11,Business,In-Person,"$3,200",,Register by Oct 27,"Learn proven sales management strategies and techniques to lead yourself, your direct reports, and your organization."
Becoming a Leader: Developing Your Style and Making Sound Decisions,https://pll.harvard.edu/course/becoming-leader-developing-your-style-and-making-sound-decisions-0/2026-09,Business,In-Person,"$3,200",,Register by Sep 13,Explore the symbiotic relationship between decision making and leadership to maximize organizational performance.
Energy to Electrochemistry Final Exam,https://pll.harvard.edu/course/energy-electrochemistry-final-exam,Science,Online,Free*,4 weeks,Available now,
Harvard Macy Institute Program for Leading Innovations in Health Care and Education,https://pll.harvard.edu/course/harvard-macy-institute-program-leading-innovations-health-care-and-education-0,Health & Medicine,In-Person,"$6,400",,Register by Apr 15,
Building Organizational Cultures: A Framework for Leaders,https://pll.harvard.edu/course/building-organizational-cultures-framework-leaders-0/2026-12,Business,In-Person,"$3,200",,Register by Dec 1,Critically assess how culture affects organizations and learn how to create an environment that promotes advancement of people.
Women's Health and Wellness,https://pll.harvard.edu/course/womens-health-and-wellness,Health & Medicine,Online,"$2,950",,Register by Apr 7,
Electrochemistry,https://pll.harvard.edu/course/electrochemistry,Science,Online,Free*,10 weeks,Available now,
China and Communism,https://pll.harvard.edu/course/china-part-9-communist-liberations,Humanities,Online,Free*,15 weeks,Available now,
Women in Leadership: Online Program for Emerging Leaders,https://pll.harvard.edu/course/women-leadership-online-program-emerging-leaders-0,Business,Online Live,"$3,050",,Register by Jul 8,Become a strategic leader by developing your key strengths and attributes.
Modern China’s Foundations: The Manchus and the Qing,https://pll.harvard.edu/course/china-part-6-manchus-and-qing,Humanities,Online,Free*,15 weeks,Available now,
Mental Health Leadership: Transformation Through Innovation,https://pll.harvard.edu/course/mental-health-leadership-transformation-through-innovation,Health & Medicine,Online,"$2,900",,Register by Dec 4,
Leadership Principles,https://pll.harvard.edu/course/leadership-principles,Business,Online,"$1,850",6 weeks,Available now,
Managing Yourself and Leading Others,https://pll.harvard.edu/course/managing-yourself-and-leading-others-1/2026-05,Business,In-Person,"$3,200",,Register by Apr 26,Evolve your leadership style to lead better and motivate others to accomplish your company's goals.
Innovation and Strategy,https://pll.harvard.edu/course/innovation-and-strategy-0/2026-10,Business,In-Person,"$3,200",,Register by Sep 27,Strengthen your organization’s capacity to drive innovation and achieve greater results.
"Advances in Genetic Medicines: Approved Therapies in CRISPR, Gene Therapies, and Oligos",https://pll.harvard.edu/course/advances-genetic-medicines-approved-therapies-crispr-gene-therapies-and-oligos,Health & Medicine,Online,$495,,Available now,
Leveraging Multi-sided Platforms with AI for Business Leaders,https://pll.harvard.edu/course/leveraging-multi-sided-platforms-ai-business-leaders-0,Business,Online Live,"$1,570",,Register by May 28,"Develop the strategies and skills you need to design, launch, and scale a successful and sustainable multi-sided digital platform."
Strategic Negotiations: Dealmaking for the Long Term,https://pll.harvard.edu/course/strategic-negotiations-dealmaking-long-term,Business,In-Person,"$15,000",1 week,Starts May 10,
Rising Generation in the Family Enterprise,https://pll.harvard.edu/course/rising-generation-family-enterprise,Business,In-Person,"$12,750",1 week,Starts Jun 17,
Authentic Leadership,https://pll.harvard.edu/course/authentic-leadership-0/2026-11,Business,In-Person,"$3,200",,Register by Oct 25,"Develop mindfulness and authenticity to build trust, create engagement, and promote productivity."
Global China: From the Mongols to the Ming,https://pll.harvard.edu/course/china-part-5-global-empire-global-economy,Humanities,Online,Free*,15 weeks,Available now,
Program for Chairs of Clinical Services,https://pll.harvard.edu/course/program-chairs-clinical-services-2,Health & Medicine,In-Person,"$11,750",,Register by Dec 18,
Leadership Coaching Strategies,https://pll.harvard.edu/course/leadership-coaching-strategies-0/2026-08,Business,In-Person,"$3,200",,Register by Aug 23,Learn leadership coaching strategies to help your team navigate business challenges and maximize performance.
"Citizen Politics in America: Public Opinion, Elections, Interest Groups, and the Media",https://pll.harvard.edu/course/citizen-politics-america-public-opinion-elections-interest-groups-and-media,Social Sciences,Online,Free*,,Available now,
Fundamentals of Neuroscience Final Exam,https://pll.harvard.edu/course/fundamentals-neuroscience-final-exam,Science,Online,$199,2 weeks,Available now,
Driving Corporate Performance: Aligning Scorecards and Structure for Strategy Execution,https://pll.harvard.edu/course/driving-corporate-performance-aligning-scorecards-and-structure-strategy-execution,Business,In-Person,"$16,000",1 week,Starts Jul 12,
Strategic Leadership,https://pll.harvard.edu/course/strategic-leadership-0/2026-06,Business,In-Person,"$4,200",,Register by Jun 7,Enhance your ability to creatively problem-solve for the demands of working in ‘the new normal'.
China’s First Empires and the Rise of Buddhism,https://pll.harvard.edu/course/chinas-first-empires-and-the-rise-of-buddhism,Humanities,Online,Free*,15 weeks,Available now,
Program for Educators in Health Professions,https://pll.harvard.edu/course/program-educators-health-professions-0,Health & Medicine,Online,"$6,800",,Register by May 27,
Strengthening Community Health Worker Programs,https://pll.harvard.edu/course/strengthening-community-health-worker-programs,Health & Medicine,Online,Free*,,Available now,
Emerging Leaders,https://pll.harvard.edu/course/emerging-leaders/2026-12,Social Sciences,In-Person,"$11,200",1 week,Register by Oct 7,
Innovation and Strategy,https://pll.harvard.edu/course/innovation-and-strategy-0/2026-12,Business,Online Live,"$2,950",,Register by Nov 23,Strengthen your organization’s capacity to drive innovation and achieve greater results.
Annual Update in Obstetrics and Gynecology,https://pll.harvard.edu/course/annual-update-obstetrics-and-gynecology,Health & Medicine,In-Person,"$1,160",,Register by Mar 11,
Skin Care and Repair,https://pll.harvard.edu/course/skin-care-and-repair,Health & Medicine,Online,$30,2 weeks,Available now,
"A.I., Machine Learning, and the Built Environment",https://pll.harvard.edu/course/ai-machine-learning-and-built-environment,Art & Design,Online,"$1,450 - $1,650",,Register by Mar 1,
Launching Tech Ventures,https://pll.harvard.edu/course/launching-tech-ventures,Business,Online,"$1,850",5 weeks,Available now,
Monteverdi’s L’Orfeo and the Birth of Opera,https://pll.harvard.edu/course/first-nights-monteverdi%E2%80%99s-l%E2%80%99orfeo-and-birth-opera,Art & Design,Online,Free*,3 weeks,Available now,
Negotiation Strategies: Building Agreement Across Boundaries,https://pll.harvard.edu/course/negotiation-strategies-building-agreement-across-boundaries/2026-04,Social Sciences,In-Person,"$10,900",1 week,Register by Mar 2,
Effective Writing for Greater Impact,https://pll.harvard.edu/course/effective-writing-greater-impact,Business,Online,$175,,Available now,
Leaders of Learning,https://pll.harvard.edu/course/leaders-learning,Education & Teaching,Online,Free*,10 weeks,Available now,
Remote Work Revolution for Everyone,https://pll.harvard.edu/course/remote-work-revolution-everyone,Business,Online,Free*,3 weeks,Available now,
The Architectural Imagination,https://pll.harvard.edu/course/architectural-imagination,Art & Design,Online,Free*,10 weeks,Available now,
Essential Management Skills for Emerging Leaders,https://pll.harvard.edu/course/essential-management-skills-emerging-leaders-0,Business,In-Person,"$6,150",,Register by Oct 11,Acquire the core skills you need to succeed as a leader.
CS50's Introduction to Programming with Python,https://pll.harvard.edu/course/cs50s-introduction-programming-python,Programming,Online,Free*,9 weeks,Available now,
Data Science for Business,https://pll.harvard.edu/course/data-science-business,Business,Online,"$1,600",4 weeks,Opens Mar 25,
Organizational Leadership,https://pll.harvard.edu/course/organizational-leadership-0,Business,Online,"$1,850",7 weeks,Available now,
Leadership for Senior Executives,https://pll.harvard.edu/course/leadership-senior-executives/2026-05,Business,In-Person,"$18,000",1 week,Starts May 31,
Beethoven's 9th Symphony and the 19th Century Orchestra,https://pll.harvard.edu/course/first-nights-beethoven%E2%80%99s-9th-symphony-and-19th-century-orchestra,Art & Design,Online,Free*,3 weeks,Available now,
Sikhism Through Its Scriptures,https://pll.harvard.edu/course/sikhism-through-its-scriptures-0,Humanities,Online,Free*,4 weeks,Available now,
Leading and Building a Culture of Innovation,https://pll.harvard.edu/course/leading-and-building-culture-innovation,Business,In-Person,"$17,000",1 week,Starts Dec 6,
Climate Change Policy: Economics and Politics Online,https://pll.harvard.edu/course/climate-change-policy-economics-and-politics-online,Science,Online,"$5,100",1 week,Register by Aug 15,
Technology Entrepreneurship: Lab to Market,https://pll.harvard.edu/course/technology-entrepreneurship-lab-market,Business,Online,Free*,5 weeks,Available now,
Becoming a Leader: Developing Your Style and Making Sound Decisions,https://pll.harvard.edu/course/becoming-leader-developing-your-style-and-making-sound-decisions-0/2026-10,Business,Online Live,"$2,950",,Register by Oct 8,Explore the symbiotic relationship between decision making and leadership to maximize organizational performance.
Leadership in Law Firms,https://pll.harvard.edu/course/leadership-law-firms/2026-09,Business,In-Person,"$19,000",1 week,Register by Aug 7,
Harvard VPAL CRISPR: Gene-editing Applications,https://pll.harvard.edu/course/harvard-vpal-crispr-gene-editing-applications,Science,Online,"$1,680",9 weeks,Starts Mar 11,
Strengthening Business Relationships: Creating Strategic Alliances and Building Trust,https://pll.harvard.edu/course/strengthening-business-relationships-creating-strategic-alliances-and-building-trust-0,Business,Online Live,"$2,850",,Register by Apr 21,Foster innovation and creativity by learning new ways to stimulate effective relationships and build powerful alliances.
In-Place Filter Testing Workshop,https://pll.harvard.edu/course/place-filter-testing-workshop-1,Health & Medicine,In-Person,"$3,000",,Register by Jul 10,
Clinical Care for Autistic Adults,https://pll.harvard.edu/course/clinical-care-autistic-adults,Health & Medicine,Online,$15,,Available now,
The Caregiver's Guide,https://pll.harvard.edu/course/caregivers-guide,Health & Medicine,Online,$30,2 weeks,Available now,
Entrepreneurial Marketing,https://pll.harvard.edu/course/entrepreneurial-marketing,Business,Online,"$1,850",4 weeks,Available now,
Strategic Project Management,https://pll.harvard.edu/course/strategic-project-management-0/2026-08,Business,In-Person,"$3,200",,Register by Aug 9,"Plan, manage, and execute projects that are essential to the success of your business."
Leadership Coaching Strategies,https://pll.harvard.edu/course/leadership-coaching-strategies-0/2026-06,Business,In-Person,"$3,200",,Register by Jun 16,Learn leadership coaching strategies to help your team navigate business challenges and maximize performance.
Influence and Persuasion in Leadership,https://pll.harvard.edu/course/influence-and-persuasion-leadership-0/2026-09,Business,In-Person,"$3,200",,Register by Sep 15,Improve your ability to influence and motivate your audience to accomplish your goals.
"HealthXcelerate: Strategy, Policy, and Systems",https://pll.harvard.edu/course/healthxcelerate-strategy-policy-and-systems/2026-03,Health & Medicine,Online,"$1,250",12 weeks,Register by Mar 11,
Management and Leadership Skills for EHS Professionals,https://pll.harvard.edu/course/management-and-leadership-skills-ehs-professionals-1,Health & Medicine,In-Person,"$3,200",,Register by Mar 20,
"Safety, Quality, Informatics and Leadership",https://pll.harvard.edu/course/safety-quality-informatics-and-leadership,Health & Medicine,In-Person,"$15,350",,Starts Aug 3,
Leading Economic Growth,https://pll.harvard.edu/course/leading-economic-growth,Social Sciences,Online,"$6,600",,Register by Aug 29,
FinTech,https://pll.harvard.edu/course/fintech,Business,Online,"$3,396",7 weeks,Starts Apr 1,
