title,url,subject,modality,price,duration,registration,description
Leading Professional Service Firms,https://pll.harvard.edu/course/leading-professional-service-firms,Business,In-Person,"$18,000",1 week,Starts Jun 21,
MalariaX: Defeating Malaria from the Genes to the Globe,https://pll.harvard.edu/course/malariax-defeating-malaria-genes-globe,Health & Medicine,Online,Free*,11 weeks,Available now,
"Infrastructure Financing, Regulation, and Management",https://pll.harvard.edu/course/infrastructure-financing-regulation-and-management,Social Sciences,In-Person,"$10,600",1 week,Register by Mar 9,
Ancient Masterpieces of World Literature,https://pll.harvard.edu/course/ancient-masterpieces-world-literature,Humanities,Online,Free*,,Available now,
The Future of Legal,https://pll.harvard.edu/course/future-legal,Social Sciences,In-Person,"$14,900",,Register by Sep 4,
CS50's Web Programming with Python and JavaScript,https://pll.harvard.edu/course/cs50s-web-programming-python-and-javascript,Programming,Online,Free*,12 weeks,Available now,
Boosting Your Energy,https://pll.harvard.edu/course/boosting-your-energy,Health & Medicine,Online,$30,2 weeks,Available now,
Managing Yourself and Leading Others,https://pll.harvard.edu/course/managing-yourself-and-leading-others-1/2026-09,Business,In-Person,"$3,200",,Register by Sep 1,Evolve your leadership style to lead better and motivate others to accomplish your company's goals.
Healthy Feet,https://pll.harvard.edu/course/healthy-feet,Health & Medicine,Online,$30,2 weeks,Available now,
United States Health Policy,https://pll.harvard.edu/course/united-states-health-policy,Social Sciences,Online,Free*,10 weeks,Available now,
Nonprofit Financial Stewardship Webinar: Introduction to Accounting and Financial Statements,https://pll.harvard.edu/course/nonprofit-financial-stewardship-webinar-introduction-accounting-and-financial-statements,Social Sciences,Online,Free*,,Available now,
Executive Leadership: Skills Experienced Leaders Need to Succeed,https://pll.harvard.edu/course/executive-leadership-skills-experienced-leaders-need-succeed-0,Business,In-Person,"$5,100",,Register by May 2,Strengthen your executive vision and presence to enhance your influence and lead your organization to success.
Global Health Care Leaders Program,https://pll.harvard.edu/course/global-health-care-leaders-program,Health & Medicine,Blended,"$33,000",,Register by Mar 2,
Leading Professional Service Firms,https://pll.harvard.edu/course/leading-professional-service-firms/2027-01,Business,In-Person,"$18,500",1 week,Starts Jan 24,
A Darkening Horizon: Nuclear Dangers Around the World with Matthew Bunn,https://pll.harvard.edu/course/darkening-horizon-nuclear-dangers-around-world-matthew-bunn,Social Sciences,Online,Free*,,Available now,
Knees and Hips,https://pll.harvard.edu/course/knees-and-hips,Health & Medicine,Online,$30,2 weeks,Available now,
Emotional Intelligence in Leadership,https://pll.harvard.edu/course/emotional-intelligence-leadership-0,Business,In-Person,"$3,300",,Register by Jun 9,Expand your leadership capacity and create an environment that fosters emotional intelligence.
Leading Green Growth: Economic Strategies for a Low-Carbon World,https://pll.harvard.edu/course/leading-green-growth-economic-strategies-low-carbon-world,Social Sciences,In-Person,"$10,600",1 week,Register by Mar 23,
Negotiation and Leadership,https://pll.harvard.edu/course/negotiation-and-leadership-10/2026-06,Business,In-Person,"$5,497",,Starts Jun 8,
Managing Your Cholesterol,https://pll.harvard.edu/course/managing-your-cholesterol,Health & Medicine,Online,$30,2 weeks,Available now,
Generative AI: How to Use It and Why It Matters,https://pll.harvard.edu/course/generative-ai-how-use-it-and-why-it-matters,Computer Science,Online,"$1,995",6 weeks,Register by Mar 2,
Women Leaders: Advancing Together,https://pll.harvard.edu/course/women-leaders-advancing-together-0,Business,In-Person,"$6,450",,Register by May 10,"A leadership program for rising women leaders and senior managers to collaborate, mentor, and advance."
Tangible Things,https://pll.harvard.edu/course/tangible-things/2026-04,Humanities,Online,Free*,10 weeks,Opens Apr 16,
Finance for Senior Executives,https://pll.harvard.edu/course/finance-senior-executives,Business,Blended,"$14,750",3 weeks,Starts Sep 17,
Allergy and Asthma: Immunological Principles and Therapeutics,https://pll.harvard.edu/course/allergy-and-asthma-immunological-principles-and-therapeutics,Health & Medicine,Online,$495,,Available now,
AI in Medicine: Foundations and Applications in Medical Practice and Research,https://pll.harvard.edu/course/ai-medicine-foundations-and-applications-medical-practice-and-research,Health & Medicine,Online,$495,,Available now,
Transforming Customer Experiences,https://pll.harvard.edu/course/transforming-customer-experiences,Business,In-Person,"$15,000",1 week,Starts Apr 26,
Data Science: Linear Regression,https://pll.harvard.edu/course/data-science-linear-regression/2026-04,Data Science,Online,Free*,8 weeks,Opens Apr 15,
Strategy Execution for Public Leadership,https://pll.harvard.edu/course/strategy-execution-public-leadership,Business,Online,"$1,600",4 weeks,Opens Apr 1,
Data Science: Inference and Modeling,https://pll.harvard.edu/course/data-science-inference-and-modeling/2026-04,Data Science,Online,Free*,,Opens Apr 15,
Lessons from Ebola: Preventing the Next Pandemic,https://pll.harvard.edu/course/lessons-ebola-preventing-next-pandemic,Health & Medicine,Online,Free*,4 weeks,Available now,
Generative AI: How to Use It and Why It Matters,https://pll.harvard.edu/course/generative-ai-how-use-it-and-why-it-matters/2026-05,Computer Science,Online,"$1,995",6 weeks,Register by Apr 27,
The Walkable City,https://pll.harvard.edu/course/walkable-city,Art & Design,In-Person,"$1,850 - $2,050",,Register by Mar 31,
Winning with Digital Platforms,https://pll.harvard.edu/course/winning-digital-platforms,Business,Online,"$1,850",5 weeks,Available now,
Data Science: Inference and Modeling,https://pll.harvard.edu/course/data-science-inference-and-modeling,Data Science,Online,Free*,8 weeks,Available now,
Leading Change and Organizational Renewal,https://pll.harvard.edu/course/leading-change-and-organizational-renewal-0,Business,Online,"$1,850",6 weeks,Available now,
Starting to Exercise,https://pll.harvard.edu/course/starting-exercise,Health & Medicine,Online,$30,2 weeks,Available now,
Fundamentals of Neuroscience Final Exam,https://pll.harvard.edu/course/fundamentals-neuroscience-final-exam/2025-10,Science,Online,$199,2 weeks,Available now,
Sustainable Investing,https://pll.harvard.edu/course/sustainable-investing,Business,Online,"$1,850",6 weeks,Available now,
The Fredric G. Levin Lung Cancer Symposium,https://pll.harvard.edu/course/fredric-g-levin-lung-cancer-symposium-0,Health & Medicine,In-Person,$200,,Register by Mar 26,
Disruptive Innovation,https://pll.harvard.edu/course/disruptive-innovation,Business,In-Person,"$16,000",1 week,Starts Jun 14,
Principles of Medical Education Maximizing Your Teaching Skills,https://pll.harvard.edu/course/principles-medical-education-maximizing-your-teaching-skills-1,Education & Teaching,Online Live,"$1,795",,Starts Mar 24,
Executive Leadership Coaching,https://pll.harvard.edu/course/executive-leadership-coaching/2026-09,Business,Online Live,"$2,950",,Register by Sep 3,"Deepen your executive coaching expertise. Apply the theories and principles of neuroscience, human development, and somatic (body-oriented) coaching to transform your executive and leadership coaching skills."
Foundations of Private Equity and Venture Capital,https://pll.harvard.edu/course/foundations-private-equity-and-venture-capital,Business,In-Person,"$12,000",1 week,Starts Mar 1,
Cell Biology: Mitochondria,https://pll.harvard.edu/course/cell-biology-mitochondria,Science,Online,Free*,4 weeks,Available now,
CS50's Introduction to Databases with SQL,https://pll.harvard.edu/course/cs50s-introduction-databases-sql,Computer Science,Online,Free*,7 weeks,Available now,
High-Dimensional Data Analysis,https://pll.harvard.edu/course/data-analysis-life-sciences-4-high-dimensional-data-analysis,Data Science,Online,Free*,4 weeks,Available now,
Nutrition and Wellness Coaching,https://pll.harvard.edu/course/nutrition-and-wellness-coaching,Health & Medicine,Online,"$4,995",,Register by Mar 5,
Energy and Thermodynamics,https://pll.harvard.edu/course/energy-and-thermodynamics,Science,Online,Free*,10 weeks,Available now,
Computer Science for Lawyers,https://pll.harvard.edu/course/computer-science-lawyers,Social Sciences,Online,"$2,250",,Available now,
Emotional Intelligence in Leadership,https://pll.harvard.edu/course/emotional-intelligence-leadership-0/2026-11-0,Business,Online Live,"$3,050",,Register by Nov 15,Expand your leadership capacity and create an environment that fosters emotional intelligence.
Senior Executives in State and Local Government,https://pll.harvard.edu/course/senior-executives-state-and-local-government/2026-07,Social Sciences,In-Person,"$17,900",3 weeks,Register by Apr 6,
Communication Strategies: Presenting with Impact,https://pll.harvard.edu/course/communication-strategies-presenting-impact-0/2026-07,Business,In-Person,"$3,200",,Register by Jul 7,"Gain the skills needed to engage, inform and inspire others — and improve your ability to communicate as a leader."
AI Ethics in Business: Managing Bias and Ethical Usage,https://pll.harvard.edu/course/ai-ethics-business-managing-bias-and-ethical-usage-0,Business,Online Live,"$2,950",,Register by Jul 26,Prepare yourself for the future and learn the best way to use new AI tools and capabilities.
"19th-Century Opera: Meyerbeer, Wagner, & Verdi",https://pll.harvard.edu/course/19th-century-opera-meyerbeer-wagner-verdi,Art & Design,Online,Free*,6 weeks,Available now,
Beyond Strategic Planning: From Implementation to Sustainment,https://pll.harvard.edu/course/beyond-strategic-planning-implementation-sustainment-0/2026-11,Business,In-Person,"$3,200",,Register by Oct 25,"Successfully navigate the challenges inherent in making your organizational, departmental, and project-specific plans come to life."
HMX Pharmacology,https://pll.harvard.edu/course/hmx-pharmacology,Health & Medicine,Online,"$1,025",,Register by Apr 7,
Introduction to Data Wise: A Collaborative Process to Improve Learning & Teaching,https://pll.harvard.edu/course/introduction-data-wise-collaborative-process-improve-learning-teaching,Education & Teaching,Online,Free*,8 weeks,Available now,
Adaptive Leadership: Practical Strategies for Change,https://pll.harvard.edu/course/adaptive-leadership-practical-strategies-change/2026-06,Business,Online,"$1,850",,Opens Jun 17,
Senior Executives in State and Local Government,https://pll.harvard.edu/course/senior-executives-state-and-local-government,Social Sciences,In-Person,"$17,900",3 weeks,Register by Apr 6,
Digital Humanities in Practice: From Research Questions to Results,https://pll.harvard.edu/course/digital-humanities-practice-research-questions-results,Data Science,Online,Free*,10 weeks,Available now,
Adaptive Leadership: Practical Strategies for Change,https://pll.harvard.edu/course/adaptive-leadership-practical-strategies-change,Business,Online,"$1,850",5 weeks,Opens Apr 8,
"Real Estate Investments: Assets, Markets, and Current Trends",https://pll.harvard.edu/course/real-estate-investments-assets-markets-and-current-trends-0,Business,In-Person,"$3,200",,Register by May 5,Master the fundamentals and practicalities of real estate investing.
Managing Yourself and Leading Others,https://pll.harvard.edu/course/managing-yourself-and-leading-others-1/2026-11,Business,In-Person,"$3,200",,Register by Nov 1,Evolve your leadership style to lead better and motivate others to accomplish your company's goals.
Managing Yourself and Leading Others,https://pll.harvard.edu/course/managing-yourself-and-leading-others-1/2026-06,Business,In-Person,"$3,200",,Register by Jun 21,Evolve your leadership style to lead better and motivate others to accomplish your company's goals.
Quantitative Methods for Biology,https://pll.harvard.edu/course/quantitative-methods-biology,Computer Science,Online,Free*,10 weeks,Available now,
Exercising Leadership: Foundational Principles,https://pll.harvard.edu/course/exercising-leadership-foundational-principles,Business,Online,Free*,4 weeks,Available now,
Applications of TinyML,https://pll.harvard.edu/course/applications-tinyml/2026-02,Computer Science,Online,Free*,6 weeks,Available now,
Disruptive Strategy,https://pll.harvard.edu/course/disruptive-strategy,Business,Online,"$1,850",6 weeks,Available now,
Guidelines for Laboratory Design: Health and Safety Considerations,https://pll.harvard.edu/course/guidelines-laboratory-design-health-and-safety-considerations-3,Health & Medicine,In-Person,"$3,200",,Register by May 5,
Economics for Managers,https://pll.harvard.edu/course/economics-managers,Business,Online,"$1,850",8 weeks,Available now,
Data Analysis: Basic Probability and Statistics,https://pll.harvard.edu/course/data-analysis-basic-probability-and-statistics,Mathematics,Online,Free*,7 weeks,Available now,
HMX Genetics,https://pll.harvard.edu/course/hmx-genetics,Health & Medicine,Online,"$1,025",,Register by Apr 7,
"International Finance: Policy, Regulation, and Transactions",https://pll.harvard.edu/course/international-finance-policy-regulation-and-transactions-0,Social Sciences,Online,"$2,450",,Available now,
The Art of Workplace Engagement: Creating a Positive Environment to Engage Employees,https://pll.harvard.edu/course/art-workplace-engagement-creating-positive-environment-engage-employees-0,Business,Online Live,"$2,950",,Register by Jun 8,Learn strategies to increase workplace productivity by improving employee satisfaction and reducing friction in times of stress.
Surgical Leadership,https://pll.harvard.edu/course/surgical-leadership,Health & Medicine,In-Person,"$20,500",,Starts Apr 26,
Aligning Strategy and Sales,https://pll.harvard.edu/course/aligning-strategy-and-sales,Business,In-Person,"$16,000",1 week,Starts Jul 26,
"Spirituality, Religion, and Mental Health",https://pll.harvard.edu/course/spirituality-religion-and-mental-health,Health & Medicine,Online Live,$575,,Register by Mar 6,
Improving your Memory,https://pll.harvard.edu/course/improving-your-memory,Health & Medicine,Online,$30,2 weeks,Available now,
Managing Yourself and Leading Others,https://pll.harvard.edu/course/managing-yourself-and-leading-others-1/2026-06-0,Business,Online Live,"$2,950",,Register by May 26,Evolve your leadership style to lead better and motivate others to accomplish your company's goals.
Agile Leadership: Transforming Mindsets and Capabilities in Your Organization,https://pll.harvard.edu/course/agile-leadership-transforming-mindsets-and-capabilities-your-organization-0/2026-08,Business,In-Person,"$4,200",,Register by Aug 23,"Learn how you can harness the agile revolution to lead more flexible, innovative, and successful teams."
Cultivating Power for Positive Impact,https://pll.harvard.edu/course/cultivating-power-positive-impact,Business,Online,$175,,Available now,
Biomarkers in Drug Development: Classification and Applications,https://pll.harvard.edu/course/biomarkers-drug-development-classification-and-applications,Health & Medicine,Online,$495,,Available now,
Leadership and Character in Uncertain Times,https://pll.harvard.edu/course/leadership-and-character-uncertain-times,Social Sciences,Online,"$4,300",5 weeks,Register by Jun 7,
Strategic Sales Management,https://pll.harvard.edu/course/strategic-sales-management-0,Business,In-Person,"$3,200",,Register by Mar 24,"Learn proven sales management strategies and techniques to lead yourself, your direct reports, and your organization."
Influence and Persuasion in Leadership,https://pll.harvard.edu/course/influence-and-persuasion-leadership-0/2026-07,Business,In-Person,"$3,200",,Register by Jul 14,Improve your ability to influence and motivate your audience to accomplish your goals.
Financial Analysis and Valuation for Lawyers,https://pll.harvard.edu/course/financial-analysis-and-valuation-lawyers,Social Sciences,Online,"$1,600",5 weeks,Opens May 6,
China Humanities: The Individual in Chinese Culture,https://pll.harvard.edu/course/china-humanities-individual-chinese-culture,Humanities,Online,Free*,,Available now,
Leadership for Social Impact,https://pll.harvard.edu/course/leadership-social-impact,Science,In-Person,"$7,100",,Register by Apr 20,
Leadership Development for Physicians in Academic Health Centers,https://pll.harvard.edu/course/leadership-development-physicians-academic-health-centers-3,Health & Medicine,Blended,"$9,500",,Register by Feb 27,
Financial Analysis and Valuation for Lawyers,https://pll.harvard.edu/course/financial-analysis-and-valuation-lawyers/2026-08,Social Sciences,Online,"$1,600",,Opens Aug 12,
Leading More Effective Teams,https://pll.harvard.edu/course/leading-more-effective-teams-0/2026-11,Business,In-Person,"$3,200",,Register by Oct 27,Enhance your team’s productivity to boost your organization’s capabilities.
Changing the Game: Negotiation and Competitive Decision-Making,https://pll.harvard.edu/course/changing-game-negotiation-and-competitive-decision-making,Business,In-Person,"$15,500",1 week,Starts Mar 22,
Leading Global Businesses,https://pll.harvard.edu/course/leading-global-businesses-0,Business,In-Person,"$18,000",1 week,Starts May 31,
Cybersecurity: Managing Risk in the Information Age,https://pll.harvard.edu/course/cybersecurity-managing-risk-information-age,Business,Online,"$3,518",9 weeks,Opens Apr 29,
Integrated Project Management,https://pll.harvard.edu/course/integrated-project-management,Business,In-Person,"$2,250 - $2,500",,Register by Mar 15,
Becoming a Leader: Developing Your Style and Making Sound Decisions,https://pll.harvard.edu/course/becoming-leader-developing-your-style-and-making-sound-decisions-0,Business,In-Person,"$3,200",,Register by Mar 22,Explore the symbiotic relationship between decision making and leadership to maximize organizational performance.
Influence and Persuasion in Leadership,https://pll.harvard.edu/course/influence-and-persuasion-leadership-0/2026-11,Business,In-Person,"$3,200",,Register by Nov 10,Improve your ability to influence and motivate your audience to accomplish your goals.
Authentic Leader Development,https://pll.harvard.edu/course/authentic-leader-development/2026-12,Business,In-Person,"$17,000",1 week,Starts Dec 6,
Building a Winning Mindset: Flexibility and Resiliency at Work,https://pll.harvard.edu/course/building-winning-mindset-flexibility-and-resiliency-work,Business,Online,$175,,Available now,
Executive Leadership Coaching,https://pll.harvard.edu/course/executive-leadership-coaching/2026-08,Business,In-Person,"$3,200",,Register by Jul 26,"Deepen your executive coaching expertise. Apply the theories and principles of neuroscience, human development, and somatic (body-oriented) coaching to transform your executive and leadership coaching skills."
Private Equity and Venture Capital,https://pll.harvard.edu/course/private-equity-and-venture-capital,Business,In-Person,"$12,750",1 week,Starts Mar 4,
Negotiation Skills: Strategies for Increased Effectiveness,https://pll.harvard.edu/course/negotiation-skills-strategies-increased-effectiveness-0/2026-07,Business,In-Person,"$3,200",,Register by Jul 7,Enhance your ability to negotiate through effective techniques and skills.
Lifestyle and Wellness Coaching,https://pll.harvard.edu/course/lifestyle-and-wellness-coaching,Health & Medicine,Online,"$2,900",,Register by Mar 26,
Effective Organizational Communciation,https://pll.harvard.edu/course/effective-organizational-communciation/2026-11,Business,In-Person,"$3,200",,Register by Oct 25,"Through small group activities and real-time feedback, you will test out new approaches and learn to communicate to inspire action."
Strategy: Building and Sustaining Competitive Advantage,https://pll.harvard.edu/course/strategy-building-and-sustaining-competitive-advantage,Business,In-Person,"$18,000",1 week,Starts May 3,
Innovation Strategy: Tools and Frameworks for Business,https://pll.harvard.edu/course/innovation-strategy-tools-and-frameworks-business/2026-06,Business,Online,"$1,850",6 weeks,Opens Jun 10,
"Literati China: Examinations, Neo-Confucianism, and Later Imperial China",https://pll.harvard.edu/course/china-part-4-new-national-culture,Humanities,Online,Free*,15 weeks,Available now,
Judaism Through Its Scriptures,https://pll.harvard.edu/course/judaism-through-its-scriptures,Humanities,Online,Free*,4 weeks,Available now,
Pyramids of Giza: Ancient Egyptian Art and Archaeology,https://pll.harvard.edu/course/pyramids-giza-ancient-egyptian-art-and-archaeology,Art & Design,Online,Free*,8 weeks,Available now,
Genetics – Essentials,https://pll.harvard.edu/course/genetics-essentials,Health & Medicine,Online,"$1,025",,Register by Apr 7,
Structure and Function of Argument: Introduction to Critical Thinking,https://pll.harvard.edu/course/structure-and-function-argument-introduction-critical-thinking,Humanities,Online,Free*,8 weeks,Available now,
We the People: Civic Engagement in a Constitutional Democracy,https://pll.harvard.edu/course/we-people-civic-engagement-constitutional-democracy,Social Sciences,Online,$0,7 weeks,Available now,
Healthy Eating for Type 2 Diabetes,https://pll.harvard.edu/course/healthy-eating-type-2-diabetes,Health & Medicine,Online,$30,2 weeks,Available now,
Public Leadership Credential,https://pll.harvard.edu/course/public-leadership-credential,Social Sciences,Online,"$1,149",6 weeks,Register by Mar 12,
Pharmacology – Essentials,https://pll.harvard.edu/course/pharmacology-essentials,Health & Medicine,Online,"$1,025",,Register by Apr 7,
Leading with Finance,https://pll.harvard.edu/course/leading-finance,Business,Online,"$1,850",6 weeks,Available now,
Communication Strategies: Presenting with Impact,https://pll.harvard.edu/course/communication-strategies-presenting-impact-0/2026-12,Business,In-Person,"$3,200",,Register by Nov 29,"Gain the skills needed to engage, inform and inspire others — and improve your ability to communicate as a leader."
Creative Thinking: Innovative Solutions to Complex Challenges,https://pll.harvard.edu/course/creative-thinking-innovative-solutions-complex-challenges-0,Business,In-Person,"$3,200",,Register by Aug 18,Learn how to grow a culture of creativity to innovate competitive solutions.
Authentic Leadership,https://pll.harvard.edu/course/authentic-leadership-0/2026-09,Business,In-Person,"$3,200",,Register by Aug 25,"Develop mindfulness and authenticity to build trust, create engagement, and promote productivity."
Creative Thinking: Innovative Solutions to Complex Challenges,https://pll.harvard.edu/course/creative-thinking-innovative-solutions-complex-challenges-0/2026-12,Business,In-Person,"$3,200",,Register by Nov 24,Learn how to grow a culture of creativity to innovate competitive solutions.
Art and Practice of Leadership Development,https://pll.harvard.edu/course/art-and-practice-leadership-development,Social Sciences,In-Person,"$11,300",1 week,Register by Apr 6,
Strategy Execution for Public Leadership,https://pll.harvard.edu/course/strategy-execution-public-leadership/2026-06,Business,Online,"$1,600",5 weeks,Opens Jun 10,
Training to Teach in Medicine,https://pll.harvard.edu/course/training-teach-medicine,Education & Teaching,Online Live,"$9,550",,Starts Nov 12,
Shakespeare’s Hamlet: The Ghost,https://pll.harvard.edu/course/shakespeares-hamlet-ghost,Humanities,Online,Free*,4 weeks,Available now,
Strategic Marketing for Driving Growth,https://pll.harvard.edu/course/strategic-marketing-driving-growth,Business,In-Person,"$15,550",1 week,Starts Sep 27,
Data Science: Wrangling,https://pll.harvard.edu/course/data-science-wrangling,Data Science,Online,Free*,8 weeks,Available now,
Nucleic Acid Therapeutics,https://pll.harvard.edu/course/nucleic-acid-therapeutics,Health & Medicine,Online,"$1,025",,Register by Apr 7,
Stress Management and Resiliency Training (SMART) Program,https://pll.harvard.edu/course/stress-management-and-resiliency-training-smart-program,Health & Medicine,Online Live,$700,,Register by Mar 4,
Business Analytics,https://pll.harvard.edu/course/business-analytics,Business,Online,"$1,850",8 weeks,Available now,
Data Science: Building Machine Learning Models,https://pll.harvard.edu/course/data-science-building-machine-learning-models,Computer Science,Online,Free*,8 weeks,Available now,
Health Care Economics,https://pll.harvard.edu/course/health-care-economics,Health & Medicine,Online,"$1,600",6 weeks,Opens May 27,
Managing Yourself and Leading Others,https://pll.harvard.edu/course/managing-yourself-and-leading-others-1/2026-04,Business,In-Person,"$3,200",,Register by Mar 31,Evolve your leadership style to lead better and motivate others to accomplish your company's goals.
Harvard Bok Higher Education Teaching Certificate,https://pll.harvard.edu/course/harvard-bok-higher-education-teaching-certificate,Education & Teaching,Online,"$2,640",9 weeks,Starts Apr 1,
Big Data for Social Good,https://pll.harvard.edu/course/big-data-social-good/2026-06,Social Sciences,Online,$950,,Opens Jun 3,
Sustainable Business Strategy,https://pll.harvard.edu/course/sustainable-business-strategy,Business,Online,"$1,850",3 weeks,Available now,
High Potentials Leadership Program,https://pll.harvard.edu/course/high-potentials-leadership-program/2026-10,Business,In-Person,"$18,500",1 week,Starts Oct 18,
"Women Making History: Ten Objects, Many Stories",https://pll.harvard.edu/course/women-making-history-ten-objects-many-stories,Humanities,Online,Free*,8 weeks,Available now,
Investment Decisions and Behavioral Finance (On-Campus),https://pll.harvard.edu/course/investment-decisions-and-behavioral-finance-campus-0,Business,In-Person,"$6,100",,Register by Oct 7,
